{
  "content": "深圳一家传统制造加工企业，财务每天在记账，销售、采购、生产和项目部门也各有数据，但老板仍然回答不了几个关键问题：订单值不值得接？材料应该采购多少？未来资金够不够？到底哪个产品、客户和项目更赚钱？进一步诊断发现，这不是财务一个部门的问题，而是销售计划、生产排产、采购备料、项目交付和资金安排之间没有形成共同的经营节奏。卡奈斯通没有继续增加彼此孤立的报表，而是从三部分入手：建立“1套年度预算＋未来12个月滚动预算”；把核算下沉到公司、品类和项目三个层级；用采购、生产、项目和资金四类台账贯通业务主流程。随后，销售解释订单变化，采购解释价格和交期，生产解释产能与损耗，项目团队解释交付与变更，财务汇总利润、资金和风险。企业由“月末看结果”，逐步转向“预算先行、过程有台账、结果可复盘”。该案例的阶段成果是经营机制发生变化，不代表其他企业可以获得固定利润增幅。",
  "title": "卡奈斯通案例：深圳制造企业如何算清利润？",
  "minPages": 3,
  "maxPages": 8,
  "width": 1080,
  "height": 1440,
  "allowRewrite": true,
  "language": "zh-CN",
  "templateId": "editorial-dark",
  "templateVersion": "1.0.0"
}
